{
  "schema_version": "context.affected-test-selection-fixture/v1alpha1",
  "fixture_id": "fixture/m7-05/affected-test-selection/v2",
  "golden_id": "golden/m7-05/current-repository/v1",
  "golden_sha256": "78bdcd8f20b0583bfaa298349f495990aef5299c40293afaef79b0906680ad5b",
  "project_revision": 58,
  "repository_revision": "aaaaaaaaaaaaaaaaaaaaaaaaaaaaaaaaaaaaaaaa",
  "evaluated_at": "2026-08-16T12:00:00Z",
  "profile": {
    "schema_version": "context.verification-profile/v1alpha1",
    "profile_id": "verification/context-control-plane/m7-05",
    "project_id": "context-control-plane",
    "profile_version": "1.0.0-alpha.1",
    "revision": 1,
    "valid_from": "2026-08-16T00:00:00Z",
    "valid_until": null,
    "gates": [
      {
        "gate_id": "build",
        "gate_kind": "build",
        "mode": "required",
        "condition_ref": null,
        "capability_refs": [
          "capability/local-python"
        ],
        "depends_on_gate_ids": [
          "tdd"
        ],
        "evidence_requirements": [
          "artifact-digest"
        ],
        "thresholds": []
      },
      {
        "gate_id": "static",
        "gate_kind": "static",
        "mode": "required",
        "condition_ref": null,
        "capability_refs": [
          "capability/local-python"
        ],
        "depends_on_gate_ids": [],
        "evidence_requirements": [
          "artifact-digest"
        ],
        "thresholds": []
      },
      {
        "gate_id": "tdd",
        "gate_kind": "tdd",
        "mode": "required",
        "condition_ref": null,
        "capability_refs": [
          "capability/local-python"
        ],
        "depends_on_gate_ids": [
          "static"
        ],
        "evidence_requirements": [
          "artifact-digest"
        ],
        "thresholds": []
      }
    ],
    "state_write_authority": false,
    "completion_authority": false,
    "profile_sha256": "5ecec560ca2bb68dbdb0f413968dfe9ed9d71920d0e7dc7eecf889add3230225"
  },
  "artifacts": {
    "artifact://sha256/016793068719cab7fea9cd3f1837ae64ff0562bf70cf85ef2309c79afd6e7da5": "{\"base_repository_revision\":\"b36c89bcd5e288af3500aa22b64c28d3e8f20372\",\"changed_paths\":[\"context_control_plane/affected_test_selection.py\"],\"repository_revision\":\"aaaaaaaaaaaaaaaaaaaaaaaaaaaaaaaaaaaaaaaa\"}",
    "artifact://sha256/0f57682e6475287506715cf0918a4f926a8097b65c8dffaa5d405d67917aee41": "{\"base_repository_revision\":\"ac172a27f99768d213c5ac5f69d2ca12558e75f4\",\"changed_paths\":[\"context_control_plane/affected_test_selection.py\"],\"repository_revision\":\"aaaaaaaaaaaaaaaaaaaaaaaaaaaaaaaaaaaaaaaa\"}",
    "artifact://sha256/0fede42ca704f1f60c53b604102af4a35841d97ac40c33448e7e336d37171507": "{\"nodes\":[{\"depends_on_node_ids\":[],\"node_id\":\"codegraph-core\",\"path_prefixes\":[\"context_control_plane/codegraph_verification.py\"]},{\"depends_on_node_ids\":[],\"node_id\":\"evidence-core\",\"path_prefixes\":[\"context_control_plane/assertion_provenance.py\"]},{\"depends_on_node_ids\":[\"evidence-core\"],\"node_id\":\"claim-evidence\",\"path_prefixes\":[\"context_control_plane/claim_evidence_gate.py\"]},{\"depends_on_node_ids\":[],\"node_id\":\"selection-core\",\"path_prefixes\":[\"context_control_plane/affected_test_selection.py\"]},{\"depends_on_node_ids\":[\"selection-core\"],\"node_id\":\"selection-benchmark\",\"path_prefixes\":[\"context_control_plane/affected_test_selection_benchmark.py\"]},{\"depends_on_node_ids\":[\"selection-core\",\"selection-benchmark\"],\"node_id\":\"selection-tests\",\"path_prefixes\":[\"tests/test_m7_05\"]}]}",
    "artifact://sha256/14bdc5846446dca1a7e3f1e51f4fe5ee31581dfbcd40017b3d93d474009f8b90": "context deterministic inventory adapter v1",
    "artifact://sha256/327fa9c5e48df7a9e70bdb0497af8e68dad10fb46c8047ac4c6e8afb28a1c863": "context graph config v1",
    "artifact://sha256/3747074d6e75e27182bba5f31c5f006387ccd47b6f3cd64dcb5b66bfedfded76": "{\"tests\":[{\"always_run\":false,\"estimated_input_bytes\":1000000,\"estimated_wall_time_ms\":2700,\"gate_id\":\"tdd\",\"node_ids\":[\"codegraph-core\"],\"test_id\":\"m6-02-unit\"},{\"always_run\":false,\"estimated_input_bytes\":1000000,\"estimated_wall_time_ms\":100,\"gate_id\":\"tdd\",\"node_ids\":[\"evidence-core\"],\"test_id\":\"m7-01-unit\"},{\"always_run\":false,\"estimated_input_bytes\":1000000,\"estimated_wall_time_ms\":700,\"gate_id\":\"tdd\",\"node_ids\":[\"claim-evidence\"],\"test_id\":\"m7-02-unit\"},{\"always_run\":false,\"estimated_input_bytes\":1000000,\"estimated_wall_time_ms\":200,\"gate_id\":\"tdd\",\"node_ids\":[\"selection-core\",\"selection-benchmark\",\"selection-tests\"],\"test_id\":\"m7-05-contract\"},{\"always_run\":true,\"estimated_input_bytes\":1000000,\"estimated_wall_time_ms\":100,\"gate_id\":\"build\",\"node_ids\":[],\"test_id\":\"python-compile\"},{\"always_run\":true,\"estimated_input_bytes\":1000000,\"estimated_wall_time_ms\":100,\"gate_id\":\"static\",\"node_ids\":[],\"test_id\":\"ruff-selection\"}]}",
    "artifact://sha256/492f0c4a8643c05a2c42abc827753a1c4f41bc961c6bafdebd3b205e39febc0d": "{\"base_repository_revision\":\"0ffe99c29686ffe2ab1fd521fdad29e6a55d3c7f\",\"changed_paths\":[\"context_control_plane/affected_test_selection.py\"],\"repository_revision\":\"aaaaaaaaaaaaaaaaaaaaaaaaaaaaaaaaaaaaaaaa\"}",
    "artifact://sha256/4ae2e603b66984f6fb7c7ed841ab44fd5f476175d1c55568d5e2554abcb3f439": "{\"base_repository_revision\":\"dd5298235feed468f3759f6db6f16ad90139e13c\",\"changed_paths\":[\"context_control_plane/assertion_provenance.py\"],\"repository_revision\":\"aaaaaaaaaaaaaaaaaaaaaaaaaaaaaaaaaaaaaaaa\"}",
    "artifact://sha256/56ff8a52ef4963a697f50ac5d52a55a4a6acc784579bcb97421d781edd766b36": "{\"base_repository_revision\":\"4098262f7e0db4165aed39425c07d1e8116a3bca\",\"changed_paths\":[\"context_control_plane/affected_test_selection.py\"],\"repository_revision\":\"aaaaaaaaaaaaaaaaaaaaaaaaaaaaaaaaaaaaaaaa\"}",
    "artifact://sha256/654e1ab8bc18a686fb9e49f093424eea26be616d2ae28768d5e34237fd429251": "{\"dynamic_edge_status\":\"none\",\"repository_revision\":\"aaaaaaaaaaaaaaaaaaaaaaaaaaaaaaaaaaaaaaaa\",\"unresolved_edge_count\":0}",
    "artifact://sha256/698b48b13d9a9e87570cf8898ce2888a1403771639b3b9238570c9d6d7435759": "context inventory config v1",
    "artifact://sha256/99d899a987ca93aeb610d4deb914c76e09f6d1507034c83063e30795de178182": "{\"base_repository_revision\":\"0ce91216993b40d9f9278a7d1a9e6dc3e7eaba35\",\"changed_paths\":[\"context_control_plane/affected_test_selection.py\"],\"repository_revision\":\"aaaaaaaaaaaaaaaaaaaaaaaaaaaaaaaaaaaaaaaa\"}",
    "artifact://sha256/b1662b5184ed7983cfa2035a4acaace07b52e5d83ba35864260a0ee8b2766d1c": "{\"base_repository_revision\":\"782bab7502ebabefaf28f4c1ea9de529f8a663ef\",\"changed_paths\":[\"context_control_plane/affected_test_selection.py\",\"generated/unknown.py\"],\"repository_revision\":\"aaaaaaaaaaaaaaaaaaaaaaaaaaaaaaaaaaaaaaaa\"}",
    "artifact://sha256/ba70b0c7f4e42a8ebe6b63c07ae56a1321667d915fa5b4ee9d1d187be63af172": "{\"dynamic_edge_status\":\"unknown\",\"repository_revision\":\"aaaaaaaaaaaaaaaaaaaaaaaaaaaaaaaaaaaaaaaa\",\"unresolved_edge_count\":1}",
    "artifact://sha256/cd27fd76ea59d68a99684697d0b60a595596f9454246bf45bf7ce6900c54d6e3": "{\"base_repository_revision\":\"faf7a6ea366bf839aa163c257bf614fadb6033b2\",\"changed_paths\":[\"generated/unknown.py\"],\"repository_revision\":\"aaaaaaaaaaaaaaaaaaaaaaaaaaaaaaaaaaaaaaaa\"}",
    "artifact://sha256/d2467decea08b637c998005d1f32cca5baca25b04756c20383e75f527e0f981c": "context deterministic graph adapter v1"
  },
  "contexts": {
    "current": {
      "project_id": "context-control-plane",
      "repository_revision": "aaaaaaaaaaaaaaaaaaaaaaaaaaaaaaaaaaaaaaaa",
      "profile_id": "verification/context-control-plane/m7-05",
      "profile_sha256": "5ecec560ca2bb68dbdb0f413968dfe9ed9d71920d0e7dc7eecf889add3230225",
      "derivation_anchors": {
        "affected-graph": {
          "subject_kind": "affected-graph",
          "adapter_id": "adapter/context/graph",
          "adapter_version": "1.0.0",
          "adapter_sha256": "d2467decea08b637c998005d1f32cca5baca25b04756c20383e75f527e0f981c",
          "config_sha256": "327fa9c5e48df7a9e70bdb0497af8e68dad10fb46c8047ac4c6e8afb28a1c863",
          "source_sha256": "0fede42ca704f1f60c53b604102af4a35841d97ac40c33448e7e336d37171507",
          "dynamic_edge_sha256": "654e1ab8bc18a686fb9e49f093424eea26be616d2ae28768d5e34237fd429251"
        },
        "required-test-inventory": {
          "subject_kind": "required-test-inventory",
          "adapter_id": "adapter/context/inventory",
          "adapter_version": "1.0.0",
          "adapter_sha256": "14bdc5846446dca1a7e3f1e51f4fe5ee31581dfbcd40017b3d93d474009f8b90",
          "config_sha256": "698b48b13d9a9e87570cf8898ce2888a1403771639b3b9238570c9d6d7435759",
          "source_sha256": "3747074d6e75e27182bba5f31c5f006387ccd47b6f3cd64dcb5b66bfedfded76",
          "dynamic_edge_sha256": null
        }
      }
    },
    "dynamic": {
      "project_id": "context-control-plane",
      "repository_revision": "aaaaaaaaaaaaaaaaaaaaaaaaaaaaaaaaaaaaaaaa",
      "profile_id": "verification/context-control-plane/m7-05",
      "profile_sha256": "5ecec560ca2bb68dbdb0f413968dfe9ed9d71920d0e7dc7eecf889add3230225",
      "derivation_anchors": {
        "affected-graph": {
          "subject_kind": "affected-graph",
          "adapter_id": "adapter/context/graph",
          "adapter_version": "1.0.0",
          "adapter_sha256": "d2467decea08b637c998005d1f32cca5baca25b04756c20383e75f527e0f981c",
          "config_sha256": "327fa9c5e48df7a9e70bdb0497af8e68dad10fb46c8047ac4c6e8afb28a1c863",
          "source_sha256": "0fede42ca704f1f60c53b604102af4a35841d97ac40c33448e7e336d37171507",
          "dynamic_edge_sha256": "ba70b0c7f4e42a8ebe6b63c07ae56a1321667d915fa5b4ee9d1d187be63af172"
        },
        "required-test-inventory": {
          "subject_kind": "required-test-inventory",
          "adapter_id": "adapter/context/inventory",